stories_id,publish_date,title,url,language,ap_syndicated,themes,media_id,media_name,media_url,css
1484895964,2020-01-02T13:58:42Z,2020 laws that give us hope for the year ahead,http://feeds.mashable.com/~r/Mashable/~3/cTkTuzWn3C8/,en,FALSE,NA,5527,Mashable!,http://mashable.com,p
1486077544,2020-01-03T15:30:00Z,We Ain’t Surprised: New Study Says Black People in California Are Stopped by Police More Than Other Groups,https://www.theroot.com/we-ain-t-surprised-new-study-says-black-people-in-cali-1840795185,en,FALSE,NA,368082,theroot.com,http://theroot.com/,.js_post-content
1497071247,2020-01-16T19:24:07Z,Rep. Ayanna Pressley goes public with alopecia and baldness,https://www.sfgate.com/entertainment/article/Rep-Ayanna-Pressley-goes-public-with-alopecia-14981797.php,en,TRUE,NA,14,SF Chronicle,http://www.sfgate.com/,p
1497098143,2020-01-16T16:00:00Z,C’mon Kansas! Will the Sunflower State Be the Next to Ban Hair Discrimination?,https://theglowup.theroot.com/cmon-kansas-will-the-sunflower-state-be-the-next-to-ba-1841044082,en,FALSE,NA,368082,theroot.com,http://theroot.com/,.js_post-content
1497117948,2020-01-16T20:37:47Z,Rep. Ayanna Pressley reveals she has alopecia,https://www.mercurynews.com/2020/01/16/rep-ayanna-pressley-reveals-she-has-alopecia/,en,FALSE,NA,35,San Jose Mercury News,http://www.mercurynews.com/,p
1503091078,2020-01-23T14:50:29Z,Texas school district bars black student from graduating with dreadlocks,https://www.theguardian.com/us-news/2020/jan/23/deandre-arnold-texas-school-district-student-dreadlocks,en,FALSE,NA,1751,Guardian US,https://www.theguardian.com/us,p
1503100107,2020-01-23T14:50:29Z,Texas school district bars black student from graduating with dreadlocks,https://www.theguardian.com/us-news/2020/jan/23/deandre-arnold-texas-school-district-student-dreadlocks,en,FALSE,NA,623382,Guardian,http://www.theguardian.com/us,.dcr-s23rjr
1503896595,2020-01-24T11:30:32Z,These 2020 laws look to level playing field for California workers,https://www.dailynews.com/2020/01/24/these-2020-laws-look-to-level-playing-field-for-california-workers/,en,FALSE,NA,24901,Bleacher Report,http://bleacherreport.com,.body-copy
1510259582,2020-01-30T14:37:43Z,"Matthew A. Cherry on the story behind ""Hair Love""",http://feeds.cbsnews.com/~r/CBSNewsMain/~3/eAhbemPSkO4/,en,FALSE,NA,1752,CBS News,http://www.cbsnews.com/,.content__body
1514973616,2020-02-07T19:00:14Z,Texas lawmakers are drafting a hair discrimination bill,http://www.startribune.com/texas-lawmakers-are-drafting-a-hair-discrimination-bill/567674382/,en,FALSE,NA,19,Star Tribune,http://www.startribune.com/,p
1510712457,2020-01-31T10:06:24Z,&#8216;Hair Love&#8217; director wants to win Oscar in honor of Kobe,https://www.seattletimes.com/entertainment/hair-love-director-wants-to-win-oscar-in-honor-of-kobe/?utm_source=RSS&utm_medium=Referral&utm_campaign=RSS_all,en,TRUE,NA,24940,Seattle Times,http://seattletimes.com,p
1516090824,2020-02-09T03:55:44Z,"The nation in brief
",http://www.arkansasonline.com/news/2020/feb/09/mississippi-fire-fatal-to-mother-6-kids/,en,FALSE,NA,56,Arkansas Democrat-Gazette,http://www2.arkansasonline.com/,p
1517111178,2020-02-10T09:30:00Z,Oscars 2020: Matthew A. Cherry Manifests #HairLove Success and Janelle Monáe Welcomes Us to the Neighborhood,https://thegrapevine.theroot.com/oscars-2020-matthew-a-cherry-manifests-hairlove-succ-1841560932,en,FALSE,NA,368082,theroot.com,http://theroot.com/,.js_post-content
1517112350,2020-02-10T09:36:31Z,"Former Bengals WR wins Oscar for 'Hair Love,' about a dad doing his daughter's hair",http://rssfeeds.cincinnati.com/~/618005974/0/cincinnati-sports~Former-Bengals-WR-wins-Oscar-for-Hair-Love-about-a-dad-doing-his-daughters-hair/,en,FALSE,NA,26590,cincinnati.com,http://cincinnati.com,.gnt_ar_b
1517154594,2020-02-10T10:40:32Z,"Matthew Cherry, Former NFL Player, Wins Oscar for Best Animated Short Film, Dedicates Award to Kobe Bryant",https://www.newsweek.com/matthew-cherry-former-nfl-player-wins-oscar-best-animated-short-film-dedicates-award-kobe-1486520?utm_source=Public&utm_medium=Feed&utm_campaign=Distribution,en,FALSE,NA,56510,Newsweek,http://newsweek.com/,p
1519299031,2020-02-12T12:48:48Z,Curl Specialist and Salon Owner Christin Brown On The Curly Hair Revolution,https://www.forbes.com/sites/mollysprayregen/2020/02/12/curl-specialist-and-salon-owner-christin-brown-on-the-curly-hair-revolution/,en,FALSE,NA,1104,Forbes,http://www.forbes.com/,.article-topline
1520107578,2020-02-13T08:00:26Z,'Hair Love' won an Oscar. It's smart. It's funny. And that makes me furious,http://rssfeeds.azcentral.com/~/618265850/0/phoenix/opinions~Hair-Love-won-an-Oscar-Its-smart-Its-funny-And-that-makes-me-furious/,en,FALSE,NA,25128,AZCentral,http://www.azcentral.com,p
1523056860,2020-02-16T14:30:00Z,Hair Love Across the Nation: 3 States Passed Laws Ending Black Hair Discrimination Within a Week,https://www.theroot.com/hair-love-across-the-nation-3-states-passed-laws-endin-1841731428,en,FALSE,NA,368082,theroot.com,http://theroot.com/,.js_post-content
1524578323,2020-02-18T06:20:07Z,"The Flash Finally Let Iris West Be Black, and Now the Show Is the Best It's Ever Been",https://www.dispatch.com/ZZ/entertainment/20200218/flash-finally-let-iris-west-be-black-and-now-show-is-best-its-ever-been?rssfeed=true,en,FALSE,NA,41,Columbus Dispatch,http://www.dispatch.com/,.gnt_ar_b
1533062738,2020-02-27T14:10:00Z,There are zero black women leading Fortune 500 companies right now. Here's how company culture can be sculpted to change that.,https://www.businessinsider.com/diversity-and-inclusion-change-company-culture-for-black-women-2020-2,en,FALSE,NA,18710,Business Insider,http://www.businessinsider.com,p
1538148647,2020-02-24T08:16:50Z,POLL: FOXX-CONWAY RACE UP IN THE AIR — JOLT FOR SCHANBACHER — SURPRISE FOR DURBIN,https://www.politico.com/newsletters/illinois-playbook/2020/02/24/poll-foxx-conway-race-up-in-the-air-jolt-for-schanbacher-surprise-for-durbin-488398,en,FALSE,NA,18268,Politico,https://www.politico.com/,.article__content
1539934264,2020-03-05T18:00:00Z,Virginia Becomes the Latest State to Ban Hair Discrimination: 'It Is Not What We Stand For',https://theglowup.theroot.com/virginia-becomes-the-latest-state-to-ban-hair-discrimin-1842132237,en,FALSE,NA,368082,theroot.com,http://theroot.com/,.js_post-content
1541533575,2020-03-07T12:29:44Z,"Protective Hairstyles Like 'Braids, Locks, and Twists' Protected Under New Virginia Bill",https://www.newsweek.com/virginia-bill-protected-hair-1491070?utm_source=Public&utm_medium=Feed&utm_campaign=Distribution,en,FALSE,NA,56510,Newsweek,http://newsweek.com/,p
1541544203,2020-03-07T12:29:44Z,"Protective Hairstyles Like 'Braids, Locks, and Twists' Protected Under New Virginia Bill",https://www.newsweek.com/virginia-bill-protected-hair-1491070?utm_source=Public&utm_medium=Feed&utm_campaign=Distribution,en,FALSE,NA,1098,Newsweek,http://www.newsweek.com/,p
1548306023,2020-03-14T14:23:35Z,"On stage and screen, artists back a cause: black hair matters",https://www.theguardian.com/uk-news/2020/mar/14/black-hair-matters-artists-back-cause,en,FALSE,NA,1751,Guardian US,https://www.theguardian.com/us,p
1562075667,2020-03-29T04:25:21Z,The politics of black hair: The battle still rages on,http://www.arkansasonline.com/news/2020/mar/29/the-politics-of-black-hair-the-battle-s/,en,FALSE,NA,56,Arkansas Democrat-Gazette,http://www2.arkansasonline.com/,p
1574992251,2020-02-10T00:30:35Z,'Hair Love' started with a Kickstarter,http://rss.cnn.com/~r/rss/cnn_topstories/~3/gY0-VZDRIFU/index.html,en,FALSE,NA,1095,CNN,http://www.cnn.com/,#body-text .l-container
1497003929,2020-01-16T17:11:24Z,Rep. Ayanna Pressley reveals she has alopecia: 'It's important I'm transparent about this new normal',http://rss.cnn.com/~r/rss/cnn_latest/~3/TJVJTmNJhQk/index.html,en,FALSE,NA,1095,CNN,http://www.cnn.com/,#body-text .l-container
1508112986,2020-01-28T16:41:57Z,Mother says son with long hair denied admission to 2 schools,https://www.cbsnews.com/news/uk-farouk-james-cant-find-school-that-will-allow-his-long-natural-hair-mother-fights-hair-discrimination-policy/,en,FALSE,NA,1752,CBS News,http://www.cbsnews.com/,.content__body
1528506444,2020-02-22T15:08:48Z,"If the governor signs this bill, Virginia will become the fourth state to ban hair discrimination",http://rss.cnn.com/~r/rss/cnn_latest/~3/adMcdnreuPI/index.html,en,FALSE,NA,1095,CNN,http://www.cnn.com/,#body-text .l-container
1510909098,2020-01-31T14:04:32Z,"Teen suspended for dreadlocks invited to Oscars by ""Hair Love"" team",http://feeds.cbsnews.com/~r/CBSNewsMain/~3/oXZYXPI2Rpw/,en,FALSE,NA,1752,CBS News,http://www.cbsnews.com/,.content__body
1497068881,2020-01-16T19:28:39Z,Rep. Ayanna Pressley goes public with alopecia and baldness,https://www.washingtonpost.com/entertainment/celebrities/rep-ayanna-pressley-goes-public-with-alopecia-and-baldness/2020/01/16/4e6851b8-38c0-11ea-a1ff-c48c1d59a4a1_story.html,en,TRUE,NA,2,Washington Post,http://washingtonpost.com,.pad-right-lg-lg
1516593863,2020-02-09T21:20:07Z,'Hair Love' went from a Kickstarter to an Oscar winner,http://rss.cnn.com/~r/rss/cnn_latest/~3/gY0-VZDRIFU/index.html,en,FALSE,NA,1095,CNN,http://www.cnn.com/,#body-text .l-container
1516936815,2020-02-10T06:23:52Z,"5 things to know for February 10: Oscars, coronavirus, 2020 Dems, White House, Thailand",http://rss.cnn.com/~r/rss/cnn_latest/~3/Xwc3JGrbGhg/index.html,en,FALSE,NA,1095,CNN,http://www.cnn.com/,#body-text .l-container
1514402827,2020-02-06T10:30:39Z,'Hair Love' filmmakers on normalizing black hair and 'girl dads',http://feeds.latimes.com/~r/latimes/entertainment/~3/O9F6XtkxQjM/oscars-2020-hair-love-girl-dads-kobe-bryant-black-hair,en,FALSE,NA,6,LA Times,http://www.latimes.com/,.story
1546367913,2020-03-12T01:26:00Z,"States are banning discrimination against black hairstyles. For some lawmakers, it’s personal.",https://www.washingtonpost.com/local/md-politics/maryland-bill-crown-act-hairstyles-discrimination/2020/03/12/c3b81582-5f05-11ea-b014-4fafa866bb81_story.html?utm_source=rss&utm_medium=referral&utm_campaign=wp_homepage,en,FALSE,NA,2,Washington Post,http://washingtonpost.com,.pad-right-lg-lg
1483908433,2020-01-01T06:41:59Z,"From plastic bags to natural hair, here are the new laws coming in 2020",http://rss.cnn.com/~r/rss/cnn_latest/~3/xKi0NYqZxHU/index.html,en,FALSE,NA,1095,CNN,http://www.cnn.com/,#body-text .l-container
1512250079,2020-02-03T04:45:17Z,The Business Of Black Hair,https://www.huffpost.com/entry/business-black-hair-care_l_5e1f77cac5b63211760d536e,en,FALSE,NA,27502,HuffPost,http://www.huffingtonpost.com/#,.js-entry-content
1517274862,2020-02-10T11:47:45Z,Oscar-winning ‘Hair Love’ director calls attention to efforts to ban race-based hair discrimination,https://www.washingtonpost.com/business/2020/02/10/hair-love-oscars-crown-act/,en,FALSE,NA,2,Washington Post,http://washingtonpost.com,.pad-right-lg-lg
1556283574,2020-03-23T07:00:43Z,"Madam C.J. Walker tackled the politics of black hair. More than a century later, the battle still rages on.",https://www.washingtonpost.com/arts-entertainment/2020/03/23/netflix-self-made-madam-cj-walker-black-hair/?utm_source=rss&utm_medium=referral&utm_campaign=wp_homepage,en,FALSE,NA,2,Washington Post,http://washingtonpost.com,.pad-right-lg-lg
1516592688,2020-02-09T21:22:13Z,‘Hair Love’ Director Matthew A. Cherry Calls For Normalizing Black Hair In Oscars Speech,https://www.huffpost.com/entry/hair-love-2020-oscars-matthew-a-cherry-crown-act_n_5e40b117c5b6f1f57f13a221,en,FALSE,NA,27502,HuffPost,http://www.huffingtonpost.com/#,.js-entry-content
1516611781,2020-02-09T21:57:48Z,"Heartwarming film ""Hair Love"" wins Oscar for best animated short",https://www.cbsnews.com/news/hair-love-wins-oscar-for-best-animated-short-matthew-cherry-2020-02-09/,en,FALSE,NA,1752,CBS News,http://www.cbsnews.com/,.content__body
1581836872,2020-01-16T00:00:00Z,"Ayanna Pressley reveals struggle with alopecia, sharing hair loss in video - The Boston Globe",https://www.bostonglobe.com/2020/01/16/metro/ayanna-pressley-reveals-struggle-with-alopecia-sharing-hair-story-loss-video/,en,FALSE,NA,15,The Boston Globe,https://www.bostonglobe.com/,p
1604626967,2020-05-12T14:15:00Z,Big Beauty Tuesday: Is Dove's 'Amplified Textures' a Drugstore 'Do'?,https://theglowup.theroot.com/big-beauty-tuesday-is-doves-amplified-textures-a-drugs-1843418878,en,FALSE,NA,368082,theroot.com,http://theroot.com/,.js_post-content
1625821277,2020-06-04T14:29:00Z,There are zero black women leading Fortune 500 companies right now. Here's how company culture can be sculpted to change that.,http://feedproxy.google.com/~r/businessinsider/~3/3LjDfSnCFFk/diversity-and-inclusion-change-company-culture-for-black-women-2020-2,en,FALSE,NA,18710,Business Insider,http://www.businessinsider.com,p
1632402210,2020-06-11T16:49:00Z,PUBLISHERS WEEKLY BEST-SELLERS,https://www.sfgate.com/entertainment/article/PUBLISHERS-WEEKLY-BEST-SELLERS-15333857.php,en,FALSE,NA,14,SF Chronicle,http://www.sfgate.com/,p
1632414892,2020-06-11T16:51:11Z,PUBLISHERS WEEKLY BEST-SELLERS,https://www.washingtonpost.com/entertainment/books/publishers-weekly-best-sellers/2020/06/11/47a1a360-ac25-11ea-a43b-be9f6494a87d_story.html,en,FALSE,NA,2,Washington Post,http://washingtonpost.com,.pad-right-lg-lg
1649769106,2020-07-01T07:46:46Z,"'Wear your crown, because change is coming': Virginia joins states banning hair discrimination",https://www.theguardian.com/us-news/2020/jul/01/virginia-crown-act-black-hair-law-bill,en,FALSE,NA,1751,Guardian US,https://www.theguardian.com/us,p
1649770031,2020-07-01T07:46:46Z,"'Wear your crown, because change is coming': Virginia joins states banning hair discrimination",https://www.theguardian.com/us-news/2020/jul/01/virginia-crown-act-black-hair-law-bill,en,FALSE,NA,623382,Guardian,http://www.theguardian.com/us,.dcr-s23rjr
1650130229,2020-07-01T14:26:40Z,Virginia Becomes The First Southern State To Officially Ban Natural Hair Discrimination,https://www.refinery29.com/en-us/2020/07/9893295/virginia-bans-natural-hair-discrimination-crown-act?utm_source=feed&utm_medium=rss,en,FALSE,NA,104698,Refinery29,http://www.refinery29.com,p
1668013177,2020-07-21T13:21:50Z,Virginia’s New Law Against Hair Discrimination and How We Got Here,https://www.forbes.com/sites/tomspiggle/2020/07/21/virginias-new-law-against-hair-discrimination-and-how-we-got-here/,en,FALSE,NA,1104,Forbes,http://www.forbes.com/,.article-topline
1681314729,2020-08-12T09:00:15Z,"Black Women With Natural Hairstyles Less Likely To Get Job Interviews, Study Reveals",https://www.huffpost.com/entry/black-women-natural-hairstyles-job-interviews-bias-study_l_5f32c915c5b64cc99fdecdfe,en,FALSE,NA,27502,HuffPost,http://www.huffingtonpost.com/#,.js-entry-content
1685917309,2020-08-17T21:40:12Z,"'Supposed to be accepting': Private school forces out Black children with locks, parents say",http://rssfeeds.cincinnati.com/~/633792603/0/cincinnati-home~Supposed-to-be-accepting-Private-school-forces-out-Black-children-with-locks-parents-say/,en,FALSE,NA,26590,cincinnati.com,http://cincinnati.com,.gnt_ar_b
1686359882,2020-08-18T08:19:05Z,"'Supposed to be accepting': Private school forces out Black children with locks, parents say",https://www.dispatch.com/news/20200818/supposed-to-be-accepting-private-school-forces-out-black-children-with-locks-parents-say?rssfeed=true,en,FALSE,NA,41,Columbus Dispatch,http://www.dispatch.com/,.gnt_ar_b
1686372328,2020-08-18T09:21:25Z,"'Supposed to be accepting': Ohio private school forces out Black children with locks, parents say",http://rssfeeds.azcentral.com/~/633831722/0/phoenix/nation~Supposed-to-be-accepting-Ohio-private-school-forces-out-Black-children-with-locks-parents-say/,en,FALSE,NA,25128,AZCentral,http://www.azcentral.com,p
1686377493,2020-08-18T09:21:25Z,"'Supposed to be accepting': Ohio private school forces out Black children with locks, parents say",http://rssfeeds.usatoday.com/~/633831722/0/usatodaycomnation-topstories~Supposed-to-be-accepting-Ohio-private-school-forces-out-Black-children-with-locks-parents-say/,en,FALSE,NA,4,USA Today,http://www.usatoday.com,.gnt_ar_b_p
1686446886,2020-08-18T10:30:00Z,What voting has and hasn’t done for women,https://www.vox.com/policy-and-politics/21364998/19th-amendment-women-equal-pay-economy-poverty-maternity-leave,en,FALSE,NA,104828,Vox,http://www.vox.com,p
1686453620,2020-08-18T10:31:20Z,Joy Reid: A Black Woman’s Hair Politics,https://www.forbes.com/sites/ebonikwilliams/2020/08/18/joy-reids-hair-story-a-political-movement/,en,FALSE,NA,1104,Forbes,http://www.forbes.com/,.article-topline
1691609346,2020-08-24T10:10:06Z,Can Archie Still Be A Prince? Here's How Meghan & Harry Stepping Down Affects Him,https://www.elitedaily.com/p/can-archie-still-be-a-prince-heres-how-meghan-harry-stepping-down-affects-him-32126131,en,FALSE,NA,70102,elitedaily.com,http://elitedaily.com/#spider,p
1693895502,2020-08-26T19:18:38Z,"Keke Palmer, Gabrielle Union, more celebs share Black hair discrimination stories in PSA",http://rssfeeds.azcentral.com/~/634533740/0/phoenix/nation~Keke-Palmer-Gabrielle-Union-more-celebs-share-Black-hair-discrimination-stories-in-PSA/,en,FALSE,NA,25128,AZCentral,http://www.azcentral.com,p
1693930506,2020-08-26T19:18:38Z,"Keke Palmer, Gabrielle Union, more celebs share Black hair discrimination stories in PSA",http://rssfeeds.usatoday.com/~/634533740/0/toppeople~Keke-Palmer-Gabrielle-Union-more-celebs-share-Black-hair-discrimination-stories-in-PSA/,en,FALSE,NA,4,USA Today,http://www.usatoday.com,.gnt_ar_b_p
1694551295,2020-08-27T11:06:56Z,"Keke Palmer, Gabrielle Union, & More Speak Out On Black Hair Discrimination In Powerful PSA — Watch",https://hollywoodlife.com/2020/08/27/keke-palmer-gabrielle-union-black-hair-discrimination-video/,en,FALSE,NA,24621,hollywoodlife.com,http://hollywoodlife.com,p
1695747337,2020-08-28T14:45:00Z,"We're Sensing a Pattern Here: Tracee Ellis Ross, Kerry Washington and More Center Black Hair This September",https://theglowup.theroot.com/were-sensing-a-pattern-here-tracee-ellis-ross-kerry-w-1844876105,en,FALSE,NA,368082,theroot.com,http://theroot.com/,.js_post-content
1699387666,2020-09-01T18:45:00Z,Big Beauty Tuesday: BREAD Has Arrived—With a Delicious Mission to Simplify Our Not-So-Basic Hair Routines,https://theglowup.theroot.com/big-beauty-tuesday-bread-has-arrived-with-a-delicious-1844918885,en,FALSE,NA,368082,theroot.com,http://theroot.com/,.js_post-content
1703125644,2020-09-05T12:21:49Z,10 Reasons Why Anti-Racism Training Is Not The Problem,https://www.forbes.com/sites/ifeomaajunwa/2020/09/05/10-reasons-why-anti-racism-training-is-not-the-problem/,en,FALSE,NA,1104,Forbes,http://www.forbes.com/,.article-topline
1703180627,2020-08-10T00:00:00Z,"Curly, coily, or kinky hair? This Rhode Island startup has natural hair care products for you - The Boston Globe",https://www.bostonglobe.com/2020/08/10/metro/curly-coily-or-kinky-hair-this-rhode-island-startup-has-natural-hair-care-products-you/?s_campaign=rhodemap:newsletter,en,FALSE,NA,15,The Boston Globe,https://www.bostonglobe.com/,p
1710489640,2020-09-14T00:00:18Z,Black-owned fashion brand launches luxury durags,https://www.theguardian.com/fashion/2020/sep/14/black-owned-fashion-brand-launches-luxury-durags,en,FALSE,NA,1751,Guardian US,https://www.theguardian.com/us,p
1711382776,2020-09-15T01:35:13Z,States see pressure to ban race-based hairstyle prejudice,https://www.startribune.com/states-see-pressure-to-ban-race-based-hairstyle-prejudice/572413852/,en,FALSE,NA,19,Star Tribune,http://www.startribune.com/,p
1711395770,2020-09-15T01:30:56Z,States see pressure to ban race-based hairstyle prejudice,https://www.sfgate.com/news/article/States-see-pressure-to-ban-race-based-hairstyle-15567436.php,en,TRUE,NA,14,SF Chronicle,http://www.sfgate.com/,p
1711934265,2020-09-15T12:05:52Z,States see pressure to ban race-based hairstyle prejudice,https://nypost.com/2020/09/15/states-see-pressure-to-ban-race-based-hairstyle-prejudice/,en,FALSE,NA,7,New York Post,http://www.nypost.com/,https://nypost.com/2020/06/03/decision-on-charges-in-george-floyd-murder-expected-wednesday/
1712092918,2020-09-15T15:46:13Z,New Mexico Considers Banning Race-based Hairstyle Prejudice,https://www.huffpost.com/entry/new-mexico-hairstyle-prejudice-ban_l_5f61170ec5b65fd7b855e6a2,en,TRUE,NA,27502,HuffPost,http://www.huffingtonpost.com/#,.js-entry-content
1713049639,2020-09-16T12:10:49Z,Natural Hair Discrimination Is Now Officially Illegal In Colorado,https://www.refinery29.com/en-us/2020/09/10028265/colorado-bans-natural-hair-discrimination-crown-act?utm_source=feed&utm_medium=rss,en,FALSE,NA,104698,Refinery29,http://www.refinery29.com,p
1718363305,2020-09-22T13:49:50Z,The House Just Passed A Law That Could End Natural Hair Discrimination Nationwide,https://www.refinery29.com/en-us/2020/09/10041077/the-crown-act-passes-house-of-representatives?utm_source=feed&utm_medium=rss,en,FALSE,NA,104698,Refinery29,http://www.refinery29.com,p
1718769025,2020-09-23T01:58:39Z,House passes bill banning race-based hairstyle discrimination,https://nypost.com/2020/09/23/congress-passes-crown-act-banning-race-based-hairstyle-discrimination/,en,FALSE,NA,7,New York Post,http://www.nypost.com/,https://nypost.com/2020/06/03/decision-on-charges-in-george-floyd-murder-expected-wednesday/
1719377072,2020-07-15T00:00:00Z,Virginia Passes The Crown Act For Natural Hair,https://www.refinery29.com/en-gb/2020/07/9895377/virginia-bans-natural-hair-discrimination-crown-act,en,FALSE,NA,104698,Refinery29,http://www.refinery29.com,p
1719533345,2020-09-23T17:40:17Z,The CROWN Act Passed The House & Is One Step Closer To Becoming Law,https://www.bustle.com/style/crown-act-passed-house-of-representatives,en,FALSE,NA,98755,Bustle,http://www.bustle.com/#spider,p
1726281297,2020-10-01T05:00:00Z,"From hairstyles to child support, these are some of the new Maryland laws going into effect Thursday",https://www.baltimoresun.com/politics/bs-pr-md-pol-october-new-laws-20201001-t753lqdmf5gqznp5s5fl53pyj4-story.html#ed=rss_www.baltimoresun.com/arcio/rss/category/maryland/howard/,en,FALSE,NA,34,Baltimore Sun,http://www.baltimoresun.com/,p
1728673730,2020-09-15T00:00:00Z,Colorado Bans Natural Hair Discrimination Crown Act,https://www.refinery29.com/en-us/2020/09/10028265/colorado-bans-natural-hair-discrimination-crown-act?utm_source=rss&utm_medium=rss_linkback2,en,FALSE,NA,104698,Refinery29,http://www.refinery29.com,p
1728683783,2020-09-15T00:00:00Z,House Of Representatives Passes Crown Act 2020,https://www.refinery29.com/en-us/2020/09/10041077/the-crown-act-passes-house-of-representatives?utm_source=rss&utm_medium=rss_linkback1,en,FALSE,NA,104698,Refinery29,http://www.refinery29.com,p
1730017984,2020-10-05T14:27:55Z,Peduto administration introduces CROWN Act bill to protect natural hairstyles,https://www.post-gazette.com/local/city/2020/10/05/Peduto-administration-introduces-CROWN-Act-bill-to-protect-natural-hairstyles-pittsburgh/stories/202010050090,en,FALSE,NA,45,Pittsburgh Post-Gazette,http://www.post-gazette.com/,p
1732588984,2020-09-24T00:00:00Z,U.S. House passes bill backed by Rep. Marcia Fudge to ban hairstyle discrimination,https://www.cleveland.com/open/2020/09/us-house-passes-bill-backed-by-rep-marcia-fudge-to-ban-hairstyle-discrimination.html,en,FALSE,NA,1641,cleveland.com,http://www.cleveland.com/,#arc-FAVUVEZ7LNCIBNNVC4IX5P2FEY
1734350032,2020-10-09T15:02:25Z,"CSUF professor looks at the intersection of beauty, hair and politics",https://www.ocregister.com/2020/10/09/csuf-professor-looks-at-the-intersection-of-beauty-hair-and-politics/,en,FALSE,NA,25,Orange County Register,http://www.ocregister.com/,.body-copy
1741676918,2020-10-17T06:00:14Z,"As nation grapples with COVID-19 and systemic racism, Democrats look to activate voters down ballot",http://rssfeeds.azcentral.com/~/637088594/0/phoenix/nation~As-nation-grapples-with-COVID-and-systemic-racism-Democrats-look-to-activate-voters-down-ballot/,en,FALSE,NA,25128,AZCentral,http://www.azcentral.com,p
1741684286,2020-10-17T06:00:14Z,"As nation grapples with COVID-19 and systemic racism, Democrats look to activate voters down ballot",https://feeds.feedblitz.com/~/637088594/0/usatoday-newstopstories~As-nation-grapples-with-COVID-and-systemic-racism-Democrats-look-to-activate-voters-down-ballot/,en,FALSE,NA,4,USA Today,http://www.usatoday.com,.gnt_ar_b_p
1744759393,2020-10-20T11:39:08Z,'Bad Hair' is so much more than scary. The Hulu horror movie delivers frightening truths,http://rssfeeds.azcentral.com/~/637301294/0/phoenix/thingstodo~Bad-Hair-is-so-much-more-than-scary-The-Hulu-horror-movie-delivers-frightening-truths/,en,FALSE,NA,25128,AZCentral,http://www.azcentral.com,p
1747069160,2020-10-22T17:26:33Z,"Review: Justin Simien is back with 'Bad Hair,' a horror comedy that cuts",https://www.latimes.com/entertainment-arts/movies/story/2020-10-22/review-justin-simien-bad-hair-horror-comedy,en,FALSE,NA,6,LA Times,http://www.latimes.com/,.story
1747308069,2020-10-22T15:00:13Z,'Sisters get fired for less than that': How 'Bad Hair' shows the horrors of Black hair,http://rssfeeds.usatoday.com/~/637405814/0/usatodaycommovies-topstories~Sisters-get-fired-for-less-than-that-How-Bad-Hair-shows-the-horrors-of-Black-hair/,en,FALSE,NA,4,USA Today,http://www.usatoday.com,.gnt_ar_b_p
1753620279,2020-10-29T07:58:16Z,Covington bans natural hair discrimination,http://rssfeeds.cincinnati.com/~/637878320/0/cincinnati-news~Covington-bans-natural-hair-discrimination/,en,FALSE,NA,26590,cincinnati.com,http://cincinnati.com,.gnt_ar_b
1764272945,2020-11-09T07:00:43Z,Op-Ed: What a buzz cut during the pandemic taught me about racism and sexism,http://feedproxy.google.com/~r/topoftheticket/~3/s-H8xqNtKvk/black-women-natural-hairstyles-racism,en,FALSE,NA,6,LA Times,http://www.latimes.com/,.story
